doi,category,clean_abs
10.1088/1755-1315/1389/1/012013,reinforcement,"Artificial intelligence (AI), machine learning (ML), and deep learning (DL) are technologies that have recently transformed many industries. The construction industry has traditionally been a laggard industry in terms of digital-technology adoption. When leading firms in this industry have experimented with these technologies, many of these experiments have met resistance. In this paper we take an institutional lens to study why and particular social structures appears to have contributed to the resistance and paucity of success stories. Within institutional research, we focus on research with traces to cognitive science and psychology. We have carried out a qualitative embedded multiple-case study on resistance to new technologies and how to overcome such resistance. The study involves four use cases in the Finnish construction industry: (1) automation of a material-product subcontractor's production planning; (2) business-model innovation by contractor on how to best work across multiple construction sites at once; (3) machine learning and automation of documentation by a software firm; and (4) promotion of a vision of information sharing across organizations by the above software firm. Based on within and cross-case analyses, preliminary empirical findings are that AI, ML and DL have in the Finnish construction industry challenged institutionalized forms of organizing and workflow established long since in the industry and, until about the time of this piece of research, taken for granted. Resistance was nonetheless beginning to be overcome at the time of writing this piece of research with small-group interaction across firms - such as those in this study - - in the industry ecosystem. Human-human mediation and face-to-face encounters were building trust in and across the organizations. The implication for practice and policy is that business transformation will not quickly and autonomously transform into ""impersonal""or machine-machine exchange but, before that, requires human-human mediation. ""In the long-term, AI and analytics have boundless potential use cases in E&C [i.e. engineering and construction]. Machine learning is gaining some momentum as an overarching use case (that is, one applicable to the entire construction life cycle, from preconstruction through O&M 8i.e. operations and management), particularly in reality capture (for example, in conjunction with computer vision) as well as for comparison of in situ field conditions with plans (for example, supporting twin models). Indeed, by applying machine learning to an ongoing project, schedules could be optimized to sequence tasks and hit target deadlines, and divergences from blueprints could be caught closer to real time and corrected using a variety of predetermined potential scenarios.""[1]"
10.1016/j.artmed.2021.102062,reinforcement,"V.Suboptimal health related behaviors and habits; and resulting chronic diseases are responsible for majority of deaths globally. Studies show that providing personalized support to patients yield improved results by preventing and/or timely treatment of these problems. Digital, just-in-time and adaptive interventions are mobile phone-based notifications that are being utilized to support people wherever and whenever necessary in coping with their health problems. In this research, we propose a reinforcement learning-based mechanism to personalize interventions in terms of timing, frequency and preferred type(s). We simultaneously employ two reinforcement learning models, namely intervention-selection and opportune-moment-identification; capturing and exploiting changes in people's long-term and momentary contexts respectively. While the intervention-selection model adapts the intervention delivery with respect to type and frequency, the opportune-moment-identification model tries to find the most opportune moments to deliver interventions throughout a day. We propose two accelerator techniques over the standard reinforcement learning algorithms to boost learning performance. First, we propose a customized version of eligibility traces for rewarding past actions throughout an agent's trajectory. Second, we utilize the transfer learning method to reuse knowledge across multiple learning environments. We validate the proposed approach in a simulated experiment where we simulate four personas differing in their daily activities, preferences on specific intervention types and attitudes towards the targeted behavior. Our experiments show that the proposed approach yields better results compared to the standard reinforcement learning algorithms and successfully capture the simulated variations associated with the personas."
10.1109/IAICT59002.2023.10205949,reinforcement,"Digital Twin (DT) is an emerging paradigm that enables a virtual model to effectively represent a physical process. In this paper, we present the adoption of the DT scheme by an offset printing company towards industrial optimization. The considered DT model is a virtual representation that serves as the digital copy of the physical printing process within an industrial unit. A virtual model for selecting the optimal machine line was developed to ensure cost-efficient printing. The machine line selection process was modeled as a decision process and then analyzed through simulations in a safe and cost-efficient digital environment, provided by the DT. Moreover, Machine Learning (ML) models were exploited to extract knowledge for the machine selection task, taking full advantage of the DT experiment. Based on real data and selection policies of a printing enterprise, the results revealed an improvement during the selection process, followed by a 5% cost reduction on the examined dataset."
10.2118/196003-ms,reinforcement,"Such an extensive data input poses a challenging task to decide on the optimal strategy of manipulating the inflow control valve (ICV) settings over time for best performance. This study investigated the use of machine learning to analyze and predict well performance given different ICV settings to ultimately maximize the well output. A commercial reservoir simulator was used to generate two synthetic reservoir models: homogeneous (Case A) and heterogenous (Case B). These synthetic data were used to train, validate, and test machine learning models. The reservoir cases were generated based on a segmented, trilateral producer completed with three ICV devices installed at tie-in segments. The data used were measurements of wellhead and downhole flow rates across ICV segments over a period of 4,000 days. A total of 1,330 experiments were conducted with an eight-day timestep, generating a total of 667,660 sample data points for each of Case A and Case B. Fully connected neural networks were used to fit the data while model generalizability was enhanced using regularization techniques, namely L2 regularization and early stopping. Both random sampling and Latin Hypercube Sampling (LHS) methods were evaluated in constructing the training, validation, and testing splits. Trained with different sample sizes drawn from the 1,330 simulated data histories for the two reservoir models, the proposed neural network showed excellent results. Given only ten simulated choices of ICV settings for training, the network proved capable of predicting oil and water production profiles at surface for both homogeneous and heterogeneous reservoir models with over 0.95 coefficient of determination (R2) when evaluated at unseen, test ICV settings. Extending the problem to downhole flow performance prediction, about 40 training simulated settings were necessary to achieve 0.95 R2. We observed that LHS was superior to random sampling in both R2 average and confidence interval. We also found that increasing the training and validation sample sizes increased the test R2 when testing against unseen cases. Study results suggest the applicability of machine reinforcement learning to estimate the well output at different ICV settings, where the neural network model depends fully on the real-time well feedback and production measurements. By using a machine learning approach during the operation of a well with multiple ICV settings, it would be feasible to estimate the lateral-by-lateral output at unseen scenarios. Hence, it becomes possible to maximize the well output by using an optimization algorithm to determine the optimal ICV settings."
10.1016/j.frl.2024.106362,reinforcement,"In the era of the current scientific and technological revolution and industrial transformation, digital technology innovation serves as a critical driver for the high-quality development of manufacturing enterprises. The dual attributes of ESG (Environmental, Social, and Governance) ratings, encompassing ""internal governance"" and ""external support,"" play a pivotal role in propelling digital technology innovation within these enterprises. This study utilizes a dual machine learning approach to empirically investigate the influence of ESG ratings on the digital technology innovation of manufacturing enterprises and explores the underlying mechanisms. Findings indicate that ESG ratings significantly boost digital technology innovation by alleviating financial market constraints, enhancing customer stability in the product market, elevating human resource levels, and increasing innovation awareness and efficiency. These improvements occur through the mechanisms of ""external support"" and ""internal governance."" Moreover, the study reveals that ESG ratings substantially enhance digital technology innovation in state-owned and high-tech manufacturing enterprises, in contrast to their limited impact on non-state-owned and non-high-tech counterparts. Conclusively, the paper proposes policy recommendations focused on heightening enterprise and societal awareness of ESG importance, intensifying supervision and enforcement, and refining the ESG rating system."
10.1016/j.procir.2021.05.020,reinforcement,"V.. All rights reserved.Digital Twins have been described as beneficial in many areas, such as virtual commissioning, fault prediction or reconfiguration planning. Equipping Digital Twins with artificial intelligence functionalities can greatly expand those beneficial applications or open up altogether new areas of application, among them cross-phase industrial transfer learning. In the context of machine learning, transfer learning represents a set of approaches that enhance learning new tasks based upon previously acquired knowledge. Here, knowledge is transferred from one lifecycle phase to another in order to reduce the amount of data or time needed to train a machine learning algorithm. Looking at common challenges in developing and deploying industrial machinery with deep learning functionalities, embracing this concept would offer several advantages: Using an intelligent Digital Twin, learning algorithms can be designed, configured and tested in the design phase before the physical system exists and real data can be collected. Once real data becomes available, the algorithms must merely be fine-tuned, significantly speeding up commissioning and reducing the probability of costly modifications. Furthermore, using the Digital Twin's simulation capabilities virtually injecting rare faults in order to train an algorithm's response or using reinforcement learning, e.g. to teach a robot, become practically feasible. This article presents several cross-phase industrial transfer learning use cases utilizing intelligent Digital Twins. A real cyber physical production system consisting of an automated welding machine and an automated guided vehicle equipped with a robot arm is used to illustrate the respective benefits."
10.1016/j.ijggc.2021.103480,reinforcement,"This study develops a machine-learning-based workflow to co-optimize the hydrocarbon recovery, CO2 sequestration volume and project net present value (NPV) simultaneously. Considering the trade-off relationships among the objective functions, support vector regression with Gaussian kernel (Gaussian- SVR) proxies are coupled with multi-objective particle swarm optimization (PSO) protocol and generate Pareto optimal solutions. Taking advantage of the high computational efficacy of the proxy model, economic uncertainties introduced by tax credits, capital costs and oil price are investigated by this study. The results indicate that the tax incentive policy (Section 45Q) plays a vital role in enhancing the economic returns of CO2-EOR projects, especially under the depression of crude oil market. The proposed workflow has been successfully implemented to optimize a water alternative CO2 (CO2-WAG) injection project in a depleted oil sand in the US. The optimization results yield an incremental oil production of 15.8 MM STB and 1.37 MM metric tons of CO2 storage in a 20-year development strategy, with the highest project NPV to be 205.6 MM US dollars."
10.3390/pharmaceutics17101331,unknown,"Background: Degenerative, metabolic and oncologic diseases are scarcely amenable to the complete reconstruction of tissue structure and functionalities using common therapeutic modalities. On the nanoscale, extracellular vesicles (EVs) and nanoparticles (NPs) have emerged as attractive candidates in regenerative and personalised medicine. However, EV transfection is hindered by its heterogeneity and low yield, while NPs suffer from cytotoxicity, immunogenicity, and long-term safety issues. Scope of Review: This review synthesises data from over 180 studies as part of a narrative synthesis, critically evaluating the disease-specific utility, mechanistic insights, and translational obstacles. The focus is laid on comparative cytotoxicity profiles, the capacities of hybrid EV–NP systems to circumvent mutual shortcomings, and the increasing impact of artificial intelligence (AI) on predictive modelling, as well as toxicity appraisal and manufacturing. Key Insights: EVs have inherent biocompatibility, immune evasive and organotropic signalling functions; NPs present structural flexibility, adjustable physicochemical properties, and industrial scalability. Common molecular pathways for NP toxicity, such as ROS production, MAPK and JAK/STAT activation, autophagy, and apoptosis, are significant biomarkers for regulatory platforms. Nanotechnological and biomimetic nanocarriers incorporate biological tropism with engineering control to enhance therapeutic efficacy, as well as their translational potential. AI approaches can support rational drug design, promote reproducibility across laboratories, and meet safe-by-design requirements. Conclusions: The intersection of EVs, NPs and AI signifies a turning point in regenerative nanomedicine. To advance this field, there is a need for convergence on experimental protocols, the adoption of mechanistic biomarkers, and regulatory alignment to ensure reproducibility and clinical competence. If realised, these endeavours will not only transition nanoscale medicament design from experimental constructs into reliable and patient-specific tools for clinical trials, but we also have the strong expectation that they could revolutionise future treatments of challenging human disorders."
10.1016/j.mattod.2024.08.013,unknown,"Its remarkable advantages of inherent self-powering, and ease of manufacture, combined with flexible electronics technologies, pave the way for the trillion-node IoT mission. Integration of machine learning into triboelectric sensing systems enables effective learning from sensory data and enhances task execution with increased intelligence. This comprehensive review explores the latest scientific and technological advancements in triboelectric sensors, providing insightful analyses in materials, physics, design principles, manufacturing strategies, monomodal and multimodal sensors, von Neumann architecture-based AI systems, and human-like neuromorphic systems. The discussion also covers diverse technological applications, including biomedicine, robotics, prosthetics, human–machine interfaces, AR/metaverse, smart homes, intelligent sports, and intelligent transportation. The narrative concludes by addressing existing challenges, contemplating potential applications, and outlining prospects in this burgeoning field. Covering from fundamental device physics, and AI integration strategies, to system applications, this review aims to illuminate the burgeoning field of triboelectric sensors, inspiring further innovation in self-powered AI-integrated systems and advanced applications, accelerating the paradigm shift toward the era of self-powered artificial intelligence of things."
10.1784/insi.2025.67.10.620,unknown,"All rights reserved.In this paper, a novel multi-criterion analysis (MCA)-based fuzzy logic (FL) model is proposed to determine the overall health index (OHI) for transformers specifically operating in cold climatic regions. The model incorporates MCA, FL and various diagnostic parameters associated with cold climatic issues such as low temperatures, pour point, kinematic viscosity, water content (WC), cold start issues, oil age, etc. The proposed model is validated using data corresponding to 200 similar in-service transformers installed in different cold climatic regions in India. Furthermore, a comparative analysis is conducted between the outputs of the proposed model and the decisions taken by the transformer diagnostic experts in the field. Evaluation reveals that 91% of the results match. Decision-making using the conventional method is limited to very few diagnostic test outcomes, whereas the proposed diagnostic model assesses the same based on a large number of significant test parameters relevant to cold environments to enable a more comprehensive health assessment. As a result, the proposed model produces an accurate and reliable output. The integration of MCA addresses the rule-overload problem inherent in conventional fuzzy logic systems, enabling a more structured and reliable decision-making process. Moreover, the model is computationally efficient, easily implementable and specifically tailored to the unique challenges faced by transformers in cold climates, making it a valuable tool for utilities and maintenance engineers."
10.1109/ICSC57768.2022.9993860,unknown,"The handling of flexible components, such as rubber sealings or cables, is an essential part of industrial manufacturing. Automating such processes through robotics is still a major challenge. Machine learning-based training of robots in combination with simulation has led to promising results in other areas of robotics. This approach can potentially be applied to assembly tasks as well. However, current simulation tools for robotics generally do not have capabilities for simulating flexible bodies. In this work, an approach for modeling such flexible bodies is proposed, which can be implemented with most common robotic simulation programs. Using the example of a rubber O-ring sealing, this approach was tested in such program and the results were compared with a professional multi-body physics engine. Realistic behavior of the O-ring was achieved with relatively low computation times."
10.1109/JPROC.2021.3054628,unknown,"One of the key targets of Industry 4.0 and digital production, in general, is the support of faster, cleaner, and increasingly customizable manufacturing processes. Additive manufacturing (AM) is a natural fit in this context, as it offers the possibility to produce complex parts without the design constraints of traditional manufacturing routes, typically reducing both material waste and time to market. Nonetheless, the lack of repeatability of the manufacturing process, which typically translates into a lack of reproducibility and reliability of the quality of the final products compared to traditional subtractive technologies, is currently one of the major barriers to the widespread adoption of AM in mass production. To overcome this limitation, there are growing efforts in recent years toward better integration of advanced information technologies into AM, exploiting the layer-by-layer nature of the build. The consequence of these efforts is twofold: 1) the integration of advanced sensing technologies into the AM systems, making possible the in situ monitoring of huge amounts of data at multiple time scales and resolutions and 2) the ever-increasing role of data-driven approaches [especially machine learning (ML)] in the analysis of such data to provide real-time quality monitoring and process optimization. This article introduces and reviews the key technological developments of this phenomenon, with a special focus on metal powder bed fusion (PBF) technologies that are attracting the highest attention by the industrial AM community. After introducing the main manufacturing quality issues and needs that have to be developed and optimized, we provide a wide overview of the latest progress of in situ monitoring and control in metal PBF, with special regards to sensing technologies and ML approaches. Finally, we identify the open challenges and future research directions in this field."
10.1007/978-981-99-7445-0_7,unknown,"2024.With the advent of Industry 4.0, more emphasis is currently being placed on the adoption of digital technologies in all areas. The current study investigates the effect of Lean-Green-Six Sigma practices on organizational performances (i.e. Operational and Financial) in relation to developing nations. A cross-sectional data set was gathered from 120 Indian manufacturing companies, and machine learning techniques were used for data analysis and result interpretation. This study gives an enhanced comprehension of ML advances in embracing Lean-Green-Six Sigma rehearses. The results show that Lean-Green-Six Sigma rehearses emphatically influence the operational and financial performance of the organizations as the adjusted R square value of 70.6 and 68.2% with P values (≤ 0.05) satisfy the hypothesis. The results likewise offer a strategy structure for supervisors, policymakers, and makers to advance Lean-Green-Six Sigma rehearses in organizations. Although a few late studies have attempted to research the force of LGSS rehearses on maintainability execution, be that as it may, not many examinations have dissected the impact of LGSS through the reception of the ML approach with regard to arising economies."
10.1117/12.2501427,unknown,"Design weak points that have narrow process window and limits wafer yield, or hotspots, continue to be a major issue in semiconductor photolithography. Resolution enhancement techniques (RET) such as advanced optical proximity correction (OPC) techniques and source mask optimization (SMO) are employed to mitigate these issues. During yield ramp for a given technology node, full-chip lithography simulation, pattern-matching and machine learning are adopted to detect and remedy the weak points from the original design [1], [2]. This is typically an iterative process by which these points are identified in short-loop lithography testing. Design retarget and/or OPC modifications are made to enhance process window until the yield goal is met. This is a high cost and time consuming process that results in a slow yield ramp for existing production nodes and increased time to market (TTM) for new node introduction. Local hotspot correction through mask and wafer harmonization is a method to enhance wafer yield with low cost and short cycle time compared to the iterative method. In this paper, a fast and low cost approach to hotspot correction is introduced. Hotspots were detected on wafer after OPC and characterized by using advanced mask characterization and optimization (AMCO) techniques. Lithographic simulations and AIMS measurement were used to verify the hotspot correction method. Finally, the validity of this new approach was evaluated by process window analysis and circuit probe yield test at wafer."
10.1109/ACCAI58221.2023.10199335,unknown,"Since the evaluation of textile fabric quality is crucial to the success of every textile business, the need for computer-based intelligent visual inspection systems is on the rise. There has been a lot of interest in the study of fabric defect identification as of late due to the increasing labor costs and the increased use of automation in the textile sector. We suggested a structure based on machine learning to identify flaws in fabrics automatically. In this study, we offer an automated AI-based fabric defect identification system that makes use of deep neural network models that have already been trained. The networks are trained using pre-processed, improved versions of the fabric pictures obtained using standard image processing methods. In order to train and categorize various fabric flaws, the LightGBM is combined with a pretrained network, AlexNet. We have also examined how well our categorization model works with varying values of the experimental variables. At long last, a thorough comparison of various methods has been provided."
