doi,category,clean_abs
10.1016/j.renene.2023.01.113,supervised,"However, modeling the fuel ethanol batch fermentation process is still a critical task. The unstructured kinetic model (UKM) is often utilized to model the process, but it encounters two problems due to the large differences in initial glucose concentrations. First, the UKM has poor predictions of the yeast growth, which is a crucial production index. Second, the kinetic parameters of the UKM are time-varying because of the changing environmental conditions. The constant manually set kinetic parameters affect the prediction accuracy. To tackle the problems, we propose a dynamic hybrid model of the fuel ethanol fermentation process. First, a biomass concentration prediction model based on extreme gradient boosting is developed. It predicts the values of biomass concentrations and mycelium growth rate as supplementary mechanism knowledge. Then, we present an artificial neural network-based model to determine the time-varying kinetic parameters. Our model can accurately predict the time series of biomass, ethanol, and glucose concentrations, with RMSEs reaching 0.3323, 1.9295, and 3.0540. Experimental results show that the dynamic hybrid model performs with satisfactory accuracy in modeling the fuel ethanol fermentation process."
10.1007/978-3-031-73617-9_26,unsupervised,"As digital data continues to grow exponentially, the reliability of Hard Disk Drives (HDDs) becomes a critical concern for ensuring data integrity and preventing unexpected system downtimes. The research dataset contains historical SMART attribute data collected from HDDs, encompassing parameters such as spin-up time, temperature reallocated sector count and other relevant metrics. The study explored usage of various exploratory data analysis (EDA) & machine learning (ML) techniques for forecasting HDD failures. EDA techniques include Synthetic Minority Over-sampling Technique (SMOTE) algorithm for balancing class representation in training set and Principal Component Analysis (PCA) for dimensionality reduction. Diverse machine learning techniques, such as Random Forest (RF), Decision Tree (DT), K-nearest Neighbors (KNN), Gaussian Naïve Bayes (GNB), Adaptive Boosting (AdaBoost), XGBoost, Gradient Boosting (GB), Linear Discriminant Analysis (LDA), Logistic Regression (LR), are employed to predict the hard drive failure. Local Interpretable Model-agnostic Explanations (LIME) is employed to identify which features have the greatest influence on a specific prediction, providing insights into the factors driving the model’s decisions. Random Forest exhibited superior performance of accuracy 99.9 and F1 score 0.98 compared to other models."
10.1016/j.compchemeng.2025.109412,unsupervised,"To optimize resource use and minimize waste, it is essential to manage these supply chains effectively, especially in the face of uncertainty. This research addresses the crucial challenge of designing a sustainable closed-loop agricultural supply chain network, with a specific focus on jujube products in the context of temperature-yield uncertainty. The model enhances economic sustainability by minimizing costs, social sustainability through job creation requirements, and environmental sustainability by implementing carbon emission caps, while taking into account decisions regarding facility locations, inter-facility flows, inventory, and shortage management. Our main contribution is a distributionally robust optimization approach that integrates a K-means clustering machine learning algorithm to generate scenarios from historical data patterns, addressing the dynamic and interrelated uncertainties in temperature-yield data. The framework incorporates closed-loop principles through thermochemical conversion processes that transform agricultural waste into value-added biochar products. A comprehensive case study of the jujube industry in South Khorasan Province, Iran, validates the model's effectiveness. Results demonstrate that moderate conservatism levels (ω between 0.8 and 1.2) achieve an 88% reduction in operational risk variability while incurring only a 3% cost increase. A comparative analysis reveals that the proposed approach achieves a 0.95 risk-adjusted performance score, outperforming traditional stochastic programming and robust optimization alternatives. This research provides agricultural supply chain managers with practical guidelines for managing temperature-yield uncertainty."
10.1007/978-981-16-1941-0_35,unsupervised,"Anomaly detection is one of the very predominant activities in manufacturing and it has many practical applications, like scrap reduction, quality testing and compliance testing. Many machine learning applications are available for anomaly detection in the literature and they are performing a decently good job. In the current study, we are describing various applications of anomaly detection in manufacturing domains, like automotive, oil and gas, pharma and consumer goods, and also some of the latest methods available in the literature to perform anomaly detection. We also highlighted some of the gaps and future scope of work in anomaly detection topics."
10.1109/DSN-S52858.2021.00027,unsupervised,"Large-scale Internet services run on a fleet of distributed servers, and the continuous availability of the hardware is key to the robustness of the services. Unplanned reboots disrupt the services running on the hardware and lower the fleet availability. Server reboots are also important signals that could indicate underlying issues such as memory leaks from the services, catastrophic hardware failures, and network or power disruptions at the datacenters.In this paper, we present an at-scale, near-realtime reboot monitoring framework built with multiple state-of-The-Art data infrastructures, as well as machine learning-based anomaly detection and automated root cause analysis across hundreds of server attribute combinations. We observed that 1% of the reboots in our hardware fleet were associated with kernel panics and out-of-memory events, and these reboots exhibit strong locality temporally and across services."
10.1002/hcs2.90,unsupervised,"Health Care Science published by John Wiley & Sons Ltd on behalf of Tsinghua University Press.Introduction: Data clustering is an important field of machine learning that has applicability in wide areas, like, business analysis, manufacturing, energy, healthcare, traveling, and logistics. A variety of clustering applications have already been developed. Data clustering approaches based on self-organizing map (SOM) generally use the map dimensions (of the grid) ranging from 2 × 2 to 8 × 8 (4–64 neurons [microclusters]) without any explicit reason for using the particular dimension, and therefore optimized results are not obtained. These algorithms use some secondary approaches to map these microclusters into the lower dimension (actual number of clusters), like, 2, 3, or 4, as the case may be, based on the optimum number of clusters in the specific data set. The secondary approach, observed in most of the works, is not SOM and is an algorithm, like, cut tree or the other. Methods: In this work, the proposed approach will give an idea of how to select the most optimal higher dimension of SOM for the given data set, and this dimension is again clustered into the lower actual dimension. Primary and secondary, both utilize the SOM to cluster the data and discover that the weight matrix of the SOM is very meaningful. The optimized two-dimensional configuration of SOM is not the same for every data set, and this work also tries to discover this configuration. Results: The adjusted randomized index obtained on the Iris, Wine, Wisconsin diagnostic breast cancer, New Thyroid, Seeds, A1, Imbalance, Dermatology, Ecoli, and Ionosphere is, respectively, 0.7173, 0.9134, 0.7543, 0.8041, 0.7781, 0.8907, 0.8755, 0.7543, 0.5013, and 0.1728, which outperforms all other results available on the web and when no reduction of attributes is done in this work. Conclusions: It is found that SOM is superior to or on par with other clustering approaches, like, k-means or the other, and could be used successfully to cluster all types of data sets. Ten benchmark data sets from diverse domains like medical, biological, and chemical are tested in this work, including the synthetic data sets."
10.1155/2022/8031024,unsupervised,"This paper analyses the automatic control effect of an electronic controller, combined with artificial intelligence technology in order to improve the automatic control of an electronic controller. In order to improve the automatic control effect of the electronic controller, a novel centralized intelligent reflective surface-assisted millimeter-wave computational imaging scheme based on pixel block division and block sparse signal recovery is proposed in this paper. Meanwhile, this paper proposes a fast block-sparse Bayesian learning algorithm. It combines the GAMP algorithm with machine learning, so it can achieve similar performance with much lower computational complexity than the traditional block sparse Bayesian learning algorithm. The simulation clustering study shows that the electronic controller automation system based on artificial intelligence technology proposed in this paper can effectively improve the control effect of the electronic controller."
10.3390/polym17141910,unsupervised,"This research article examines the CO2 laser cutting performance of Fused Filament Fabricated Acrylonitrile Styrene Acrylate (ASA) thermoplastics by analyzing the influence of plate thickness, laser power, and cutting speed on four quality characteristics: surface roughness (Ra), top kerf width (Top KW), bottom kerf width (Bottom KW), and bottom heat-affected zone (Bottom HAZ). Forty-five experiments were conducted using five thickness levels, three power levels, and three cutting speeds. To model and predict these outputs, seven machine learning approaches were employed: Autoencoder, Autoencoder–Gated Recurrent Unit, Autoencoder–Long Short-Term Memory, Random Forest, Extreme Gradient Boosting (XGBoost), Support Vector Regression, and Linear Regression. Among them, XGBoost yielded the highest accuracy across all performance metrics. Analysis of Variance results revealed that Ra is mainly affected by plate thickness, Bottom KW by cutting speed, and Bottom HAZ by power, while Top KW is influenced by all three parameters. The study proposes an effective prediction framework using multi-output modeling and hybrid deep learning, offering a data-driven foundation for process optimization. The findings are expected to support intelligent manufacturing systems for real-time quality prediction and adaptive laser post-processing of engineering-grade thermoplastics such as ASA. This integrative approach also enables a deeper understanding of nonlinear dependencies in laser–material interactions."
10.21595/vp.2019.20617,unsupervised,"A wind turbine works under variable load and environmental conditions because of which failure rate has been on the rise. Failure of a gearbox, an integral part of producing wind energy, contributes to 80 % of the total downtime for the wind turbine. For ensuring better utilization of the wind turbines, Fault prognosis and condition monitoring of bearings are of utmost importance as it helps to reduce the downtime by early detection of faults which further increases the power output. In this paper, vibration signals produced and machine learning approach to determine the Remaining Useful Life (RUL) for a degraded bearing is studied. The methodology includes statistical feature extraction analysis with regression models. Further the feature selection is done using Principal Component Analysis (PCA) technique which produces training and testing sets which acts as an input parameter for regression models such as Support Vector Regressor (SVR) and Random Forest (RF). Weibull Hazard Rate Function is used for calculating the RUL of the bearing. Results This study shows the potential application of regression model as an effective tool for degradation performance prediction of bearing."
10.1016/j.cma.2024.117372,unsupervised,"V.Recent breakthroughs in advanced manufacturing capabilities have made it possible to design and print sophisticated topologies of cellular structures using diverse engineering materials such as metals, polymers, and ceramics. In these architectured materials, it is often desirable to tailor the mechanical properties by altering the unit cell topology. This necessitates an in-depth understanding of how the topology of the unit cell structure affects the macroscopic behavior of the material in both the linear and the non-linear regimes encountered under large compression. We have developed a machine learning (ML) approach capable of accelerating the prediction of the stress–strain response of a polymer-based cellular structure under uniaxial confined compression. As part of generating the training data for ML, 60,000 mesostructures were generated using a relatively novel approach based on cellular automata, and their corresponding stress–strain responses were obtained from the finite element simulations. Principal component analysis (PCA) was used to reduce the dimensionality of the stress–strain curves. With only 20 principal components, PCA captured 99.89% of the variance in the stress–strain curves while reducing the dimensionality by 5X. ML using supervised autoencoder was able to successfully speed up the prediction of the non-linear stress–strain response of a unit cell by up to 4600X. The proposed method can serve as an efficient data generation tool and a rapid means for predicting the structure–property relationship through accelerated forward modeling of cellular materials under compaction, in cases where the macroscopic stress–strain response is governed by the unit-cell topology."
10.4018/979-8-3693-7525-9.ch003,unsupervised,"Machine learning (ML) is driving change in aerospace design and manufacturing in order to increase efficiency, safety, and innovation. Complex designs and requirements required in aerospace industry. ML can improve design quality, support design thinking by generating multiple options, and enhance predictive analytics to detect potential problems. ML makes manufacturing processes smarter by predicting demand and managing resources effectively, increasing operational efficiency and improving product quality. ML helps to prevent errors and increase safety and security through predictive maintenance, non-destructive testing, and anomaly detection. ML can handle challenges such as data collection, interpreting in a safety-critical business context. ML offers great opportunities, from AI-powered innovation and human-machine collaboration to the potential impact of quantum computing in solving complex aerospace problems. Continued advances in machine learning will help to shape the future of aerospace, making machines more efficient, safer, and more innovative."
10.1109/MLSP55844.2023.10285973,unsupervised,"Time series classification is a fundamental task in many domains such as finance, healthcare, and manufacturing. Traditional machine learning techniques are limited in their ability to deal with the temporal nature of time series data, making representation learning an effective approach. Randomized machine learning is gaining interest as many cases it can outperform deep learning. However, it often requires many features, which can be an issue with high-dimensional training data and low-sample sizes. To address this issue, we propose a novel and efficient approach that utilizes a new and fast metric to evaluate features, called the Scatter Score (SS), and a new temporal-aware down-sampling strategy, called randomized threshold exceedance rate (rTER). Our method achieves significant improvements in classification performance compared to state-of-the-art methods such as ROCKET, miniROCKET, ResNet, and InceptionTime, as demonstrated on 30 different datasets."
10.1016/j.geoen.2025.213991,unsupervised,"However, the diversity of evaluation parameters limits hydraulic fracturing optimization. Therefore, we propose an adaptive-category-gaussian-mixture-model (AC-GMM) based on a geology engineering framework, combining reservoir quality (RQ) and completion quality (CQ) to classify the composite quality index (CQI). The classification serves as the basis for an intelligent algorithm developed for fracturing design. Taking three typical wells from the Lucaogou Formation in the Junggar Basin in China as examples the following research results are summarized. First, the AC-GMM model can finely identify the fracturing grades, achieving a conformity rate of over 90 % with the field production data. Second, the paper obtains three types of fracturing grades (I, II, III) and further refines them into four grades (I, II1, II2, III), the grade I considers both high RQ and CQ, while grade II only regards the better of the double quality, and prioritizes the better CQ. Third, the intelligent algorithm groups similar qualities into the same stage, achieving up to 96 % intra-stage homogeneity, significantly enhancing hydraulic fracturing efficiency for long horizontal wells. Our work provides a data-driven framework for optimizing multi-stage fracturing designs in shale reservoirs."
10.1109/BigData55660.2022.10020836,unsupervised,"Enabled by the increasing availability of sensor data monitored from production machinery, condition monitoring and predictive maintenance methods are key pillars for an efficient and robust manufacturing production cycle in the Industrial Internet of Things. The employment of machine learning models to detect and predict deteriorating behavior by analyzing a variety of data collected across several industrial environments shows promising results in recent works, yet also often requires transferring the sensor data to centralized servers located in the cloud. Moreover, although collaborating and sharing knowledge between industry sites yields large benefits, especially in the area of condition monitoring, it is often prohibited due to data privacy issues. To tackle this situation, we propose an Autoencoder-based Federated Learning method utilizing vibration sensor data from rotating machines, that allows for a distributed training on edge devices, located on-premise and close to the monitored machines. Preserving data privacy and at the same time exonerating possibly unreliable network connections of remote sites, our approach enables knowledge transfer across organizational boundaries, without sharing the monitored data. We conducted an evaluation utilizing two real-world datasets as well as multiple testbeds and the results indicate that our method enables a competitive performance compared to previous results, while significantly reducing the resource and network utilization."
10.1007/978-981-13-2375-1_63,unsupervised,"In the background of intelligent manufacturing, fault diagnosis is more and more important. In order to reduce the time and space cost of mass multidimensional data in machine learning fault diagnosis algorithm, a fault diagnosis framework based on DEMATEL and Support Vector Machine is proposed in this paper. DEMATEL algorithm can reduce the dimensions of data and Support Vector Machine can better solve the problem of multiple classification of small sample with non-linear feature and classify the fault data after dimensionality reduction. The framework proposed in this paper improves the efficiency of fault diagnosis effectively and ensures the further development of intelligent manufacturing."
10.1109/ICPHM57936.2023.10193957,unsupervised,"The detection of anomalies in printed circuit boards (PCBs) is an important challenge in the electronics manufacturing industry. Traditional anomaly detection methods often struggle to handle imbalanced datasets, which are common in real-world PCB production. In recent years, machine learning (ML) algorithms have emerged as a promising solution to this problem. This study investigates the use of ML algorithms for anomaly detection in PCBs, with a particular focus on addressing the issue of imbalanced data. We propose a data-level technique to balance the dataset and improve the performance of the ML algorithm. Our results show that our approach outperforms traditional methods in terms of precision, recall, and F1 score. Overall, this study demonstrates the potential of ML in addressing the challenge of anomaly detection in PCBs and highlights the importance of considering imbalanced data in such applications."
10.1109/TASE.2024.3486688,unsupervised,"Industrial environments pose distinctive challenges for anomaly detection, primarily stemming from the complexities associated with high dimensionality and the dynamic nature of data patterns over time. These properties determine that the model's proper convergence on unlabeled data is unpromising, consequently leading to less efficient discrimination of anomalies in previous anomaly detection (AD) works. To address this problem, we present AnoDual, a novel, meta-learning AD framework. From the perspective of data reconstruction, we introduce the multi-memory enhanced VAE reconstructor M2ER, which learns to extract the most salient patterns in unlabeled noisy data through a self-supervised manner. This design eases impacts from potential anomalous components during data reconstruction, and enhances the discernibility of anomalies. To address performance degradation caused by the numerical deviation based AD scheme in most existing works, we design a dual-source self-supervised discriminator DSD, which examines characteristics in the domain of representations. This model actively assesses discrepancies between data pairs and representation pairs in parallel, and conducts AD on a fine-grained scale. In this way, anomalies that used to be unnoticed due to a less prominent numerical deviation can be spotted. Besides, we propose a meta-learning powered training pipeline to enable model training even when no real label is available, which is common in the industry. Extensive experiments on five large-scale real-world industrial datasets suggest that AnoDual achieves an average F1-Score with a substantial increment of 3.39 %, outperforming the latest state-of-the-art baseline. Note to Practitioners - A generative model plus a numerical threshold based detection approach currently takes a significant share in both academia and the industry. However, the performance of this workflow is not promising in actual applications, with multiple factors contributing to this situation. The proper convergence of such generative models is difficult when the training material contains noisy samples - an over-expressed generative model would result in less significant reconstruction discrepancies for anomalies that are hard to notice. In addition, selecting a numerical threshold, which is used to spot anomalies, requires multiple laborious attempts, and can hardly adapt to an ever-changing pattern in industrial environments. These circumstances make it challenging to apply prior works in practical production, which, in turn, urges the need to develop an effective methodology to address the need for industrial anomaly detection. This manuscript includes a novel, meta-learning powered framework AnoDual, which is tailored for industrial scenarios. This framework discards the conventional design of comparing the reconstruction error numerically, but introduces a solution based on the differentiation of the representations. Besides, the multi-head attention enhanced variational autoencoder also leads to a much more pronounced discrepancy for anomalous samples, which benefits their successful detection. Providing a flexible and robust way to detect anomalies on deployed IoT assets, this work can be further transformed to serve applications in many other domains."
10.1016/j.egyr.2022.10.265,unsupervised,"Methane is an energy carrier and a critical component in the total biogas generated in a digestion process, thus necessitating more attention on the fraction of methane in the biogas yield. However, most previous studies in literature had focused on the volumetric yield of methane with little or no attention given to the fractional composition of methane in the total biogas produced. The deficiency of the classical technique in controlling the process parameters for optimal yield has motivated the need for machine learning-based techniques for modelling the methane fraction of biogas in a large-scale plant. In this study, a fuzzy c-mean (FCM)-clustered adaptive neuro-fuzzy inference system (ANFIS) was developed to model the methane fraction of biogas in an industrial-scale plant. The FCM clustering technique was preferred owing to its computational speed boost capability. The model was simulated using the control parameters of the algorithms while the optimal model was selected after testing their performance using relevant statistical metrics. The best model was obtained with ANFIS-FCM model with 8 clusters giving Root Mean Square Error (RMSE), Mean Absolute Deviation (MAD), Average Absolute Percentage Relative Error (AAPRE), Relative Mean Bias Error (rMBE) and correlation coefficient (R2) values of 3.156, 2.236, 3.015, 0.306, 0.978 respectively at the training phase and 4.936, 3.245, 3.456. 0.306, 0.956 respectively at the testing phase. The statistical metrics values obtained implied that FCM-ANFIS is a satisfactory model to predict methane fraction successfully."
