doi,category,clean_abs
10.1109/BigData.2015.7363874,unsupervised,"Data is increasingly affecting the automotive industry, from vehicle development, to manufacturing and service processes, to online services centered around the connected vehicle. Connected, mobile and Internet of Things devices and machines generate immense amounts of sensor data. The ability to process and analyze this data to extract insights and knowledge that enable intelligent services, new ways to understand business problems, improvements of processes and decisions, is a critical capability. Hadoop is a scalable platform for compute and storage and emerged as de-facto standard for Big Data processing at Internet companies and in the scientific community. However, there is a lack of understanding of how and for what use cases these new Hadoop capabilities can be efficiently used to augment automotive applications and systems. This paper surveys use cases and applications for deploying Hadoop in the automotive industry. Over the years a rich ecosystem emerged around Hadoop comprising tools for parallel, in-memory and stream processing (most notable MapReduce and Spark), SQL and NOSQL engines (Hive, HBase), and machine learning (Mahout, MLlib). It is critical to develop an understanding of automotive applications and their characteristics and requirements for data discovery, integration, exploration and analytics. We then map these requirements to a confined technical architecture consisting of core Hadoop services and libraries for data ingest, processing and analytics. The objective of this paper is to address questions, such as: What applications and datasets are suitable for Hadoop? How can a diverse set of frameworks and tools be managed on multi-tenant Hadoop cluster? How do these tools integrate with existing relational data management systems? How can enterprise security requirements be addressed? What are the performance characteristics of these tools for real-world automotive applications? To address the last question, we utilize a standard benchmark (TPCx-HS), and two application benchmarks (SQL and machine learning) that operate on a dataset of multiple Terabytes and billions of rows."
10.1145/3592149.3592161,unsupervised,"O-RAN is radically shifting how cellular networks are designed, deployed and optimized through network programmability, disaggregation, and virtualization. Specifically, RAN Intelligent Controllers (RICs) can orchestrate and optimize the Radio Access Network (RAN) operations, allowing fine-grained control over the network. RICs provide new approaches and solutions for classical use cases such as on-demand traffic steering, anomaly detection, and Quality of Service (QoS) management, with an optimization that can target single User Equipments (UEs), slices, cells, or entire base stations. Such control can leverage data-driven approaches, which rely on the O-RAN open interfaces to combine large-scale collection of RAN Key Performance Measurements (KPMs) and state-of-The-Art Machine Learning (ML) routines executed in the RICs. While this comes with the potential to enable intelligent, programmable RANs, there are still significant challenges to be faced, primarily related to data collection at scale, development and testing of custom control logic for the RICs, and availability of Open RAN simulation and experimental tools for the research and development communities. To address this, we introduce ns-O-RAN, a software integration between a real-world near-real-Time RIC and an ns-3 simulated RAN which provides a platform for researchers and telco operators to build, test and integrate xApps. ns-O-RAN extends a popular Open RAN experimental framework (OpenRAN Gym) with simulation capabilities that enable the generation of realistic datasets without the need for experimental infrastructure. We implement it as a new open-source ns-3 module that uses the E2 interface to connect different simulated 5G base stations with the RIC, enabling the exchange of E2 messages and RAN KPMs to be consumed by standard xApps. Furthermore, we test ns-O-RAN with the O-RAN Software Community (OSC) and OpenRAN Gym RICs, simplifying the onboarding from a test environment to production with real telecom hardware controlled without major reconfigurations required. ns-O-RAN is open source and publicly available, together with quick-start tutorials and documentation."
10.3390/su16093552,unsupervised,"Background: This paper examines scientific papers in the field of digital twins to explore the different areas of application in supply chains. Methods: Using a machine learning-based topic modeling approach, this study aims to provide insights into the key areas of supply chain management that benefit from digital twin capabilities. Results: The research findings highlight key priorities in the areas of infrastructure, construction, business, technology, manufacturing, blockchain, and agriculture, providing a comprehensive perspective. Conclusions: Our research findings confirm several recommendations. First, the machine learning-based model identifies new areas that are not addressed in the human review results. Second, while the human review results put more emphasis on practicality, such as management activities, processes, and methods, the machine learning results pay more attention to macro perspectives, such as infrastructure, technology, and business. Third, the machine learning-based model is able to extract more granular information; for example, it identifies core technologies beyond digital twins, including AI/reinforcement learning, picking robots, cybersecurity, 5G networks, the physical internet, additive manufacturing, and cloud manufacturing."
10.22399/ijcesen.1099,reinforcement,"The rapid advancements in Industry 4.0 and smart manufacturing systems have necessitated the integration of Artificial Intelligence (AI) and Digital Twin Technology (DTT) to enhance operational efficiency and predictive maintenance strategies. This study proposes an AI-driven predictive maintenance framework that leverages Digital Twin Technology to enable real-time monitoring, fault diagnosis, and failure prediction in industrial environments. The framework integrates machine learning (ML) models, deep learning techniques, and edge computing to analyze sensor data, detect anomalies, and optimize maintenance schedules. A reinforcement learning-based decision model is employed to dynamically adjust maintenance strategies, reducing downtime and extending equipment lifespan. Additionally, physics-informed AI models are incorporated into the digital twin architecture to simulate operational behaviours and predict potential failures with high accuracy. The proposed system is validated through a case study in a smart manufacturing plant, demonstrating a 35% improvement in predictive accuracy, 40% reduction in unplanned downtimes, and 25% optimization in maintenance costs compared to traditional predictive maintenance approaches. The findings indicate that the integration of AI and DTT significantly enhances the reliability and efficiency of cyber-physical manufacturing systems (CPMS), paving the way for more autonomous and intelligent industrial operations."
10.1080/00207543.2021.1973138,reinforcement,"Published by Informa UK Limited, trading as Taylor & Francis Group.Shortening product development cycles and fully customisable products pose major challenges for production systems. These not only have to cope with an increased product diversity but also enable high throughputs and provide a high adaptability and robustness to process variations and unforeseen incidents. To overcome these challenges, deep Reinforcement Learning (RL) has been increasingly applied for the optimisation of production systems. Unlike other machine learning methods, deep RL operates on recently collected sensor-data in direct interaction with its environment and enables real-time responses to system changes. Although deep RL is already being deployed in production systems, a systematic review of the results has not yet been established. The main contribution of this paper is to provide researchers and practitioners an overview of applications and to motivate further implementations and research of deep RL supported production systems. Findings reveal that deep RL is applied in a variety of production domains, contributing to data-driven and flexible processes. In most applications, conventional methods were outperformed and implementation efforts or dependence on human experience were reduced. Nevertheless, future research must focus more on transferring the findings to real-world systems to analyse safety aspects and demonstrate reliability under prevailing conditions."
10.1016/j.procir.2020.02.157,reinforcement,"Published by Elsevier B.V.Faced with rapidly changing technologies, diminishing product life cycles and heightened global competition, product portfolio managers across all industries encounter increasing challenges within portfolio design processes. Aligning the product portfolio with corporate strategies is central to sustain long-term company success. However, regarding volatile environments, this is becoming increasingly challenging. In the last decades, product portfolio decisions were based on subjective experience, but this is no longer sufficient. Nowadays, as portfolio complexity grows constantly, data-based decision support procedures are needed to enable effective decisions in product portfolio management. Regarding the field of portfolio management, only little research has been conducted on the usage of data-based analytical methods. Additionally, the alignment of product portfolios with corporate strategies is still largely unexplored and, in this context, the application of analytical methods has been largely omitted until now. This paper proposes a methodology that uses neural networks with supervised learning to model correlations among product portfolio control parameters and corporate goal indicators. Based on this, reinforcement learning is applied to derive goal-conform recommendations for product portfolio managers. For both supervised and reinforcement learning, the presented methodology includes generic steps for implementation. Moreover, for both machine learning methods, requirements regarding necessary product portfolio data are elaborated. The methodology is validated using a case study."
10.1080/17480930.2024.2362579,reinforcement,"Nowadays, open-pit mining is the large-scale extraction of valuable ore materials from the surface with the use of modern mining equipment. If not operated properly, various unexpected events, such as equipment breakdown, slope collapse, hazardous gas emission and land pollution, would occur. With the rapid development of computer technology and big-data science, emerging applications of machine learning could significantly improve mining predictability, feasibility, efficiency and sustainability. However, there is still a lack of up-to-date systematic literature reviews on applications of machine learning to open-pit mining. To address this issue, this study reviews over 200 relevant papers mainly published in the last five years. In this review, we initially conduct a descriptive statistical analysis of these papers according to different phases in open-pit mining. Consequently, we classify their research findings into four main categories: exploration, exploitation, production and reclamation. In addition, each main category is further divided into some sub-categories, namely, feasibility evaluation and mine design planning in exploration; mine block sequencing in exploitation; drilling, blasting, haulage and processing in production; waste control and environmental protection in reclamation. Based on such a bi-level classification, we systematically summarise promising machine learning techniques (i.e. reinforcement learning and deep reinforcement learning) and potential research opportunities (e.g. integration of machine learning and simulation for mining equipment scheduling) in real-world implementations for the mining industry."
10.1016/j.vaccine.2025.127607,reinforcement,"However, data on the regulatory factors needed for sustainable vaccine manufacturing have been sparse, including in resource-limited settings. This study aims to identify the regulatory factors for sustainable vaccine manufacturing in Asia and the Pacific. Methods: The five countries selected for this study are Bangladesh, India, Indonesia, Republic of Korea and Singapore, which are member countries of the Asian Development Bank (ADB) with different states of vaccine manufacturing and regulatory capacities. The study comprises a scoping review and semi-structured interviews with key informants from the industry, government policy making authorities and regulatory agencies across these five countries. The scoping review retrieved 71 scientific publications comprising published literature from Pubmed, Embase and grey literature, and the semi-structured interviews included a total of 39 interviews with policymakers (n = 7), regulators (n = 7) and vaccine industry (developers/manufacturers) (n = 25). Content analysis was performed using a positivist, predominantly deductive approach, analysing the regulatory challenges, opportunities and recommendations across the vaccine life cycle. Findings: The key regulatory factors for sustainable vaccine manufacturing identified include collaboration, regulatory capacity building, regulatory alignment, strengthened regulatory systems and regulatory agility. Interpretation: These results provide relevant and important evidence to inform regulatory policy as countries globally seek to establish regional vaccine production capabilities for vaccine security. Funding: Asian Development Bank (ADB)."
10.1007/978-3-030-24854-3_13,reinforcement,"We investigate the use of deep reinforcement learning to optimize business processes in a business support system. The focus of this paper is to investigate how a reinforcement learning algorithm named Q-Learning, using deep learning, can be configured in order to support optimization of business processes in an environment which includes some degree of uncertainty. We make the investigation possible by implementing a software agent with the help of a deep learning tool set. The study shows that reinforcement learning is a useful technique for business process optimization but more guidance regarding parameter setting is needed in this area."
10.1109/ICMNWC63764.2024.10872082,reinforcement,"The increasing complexity and interconnectedness of Internet of Things (IoT) software systems necessitate the development of intelligent solutions for predictive maintenance and security. Conventional techniques often fail to provide real-time insights and proactive responses due to the diverse and dynamic nature of IoT environments. To address these challenges, cognitive technologies offer promising avenues for enhancing the operational efficiency and security of IoT networks. This paper introduces Cognitive Twins, an AI-driven framework designed to optimize predictive maintenance and strengthen security in IoT software systems. Cognitive Twins leverage advanced machine learning models and real-time data streams to create dynamic digital replicas of IoT devices and software components. The framework employs a combination of deep learning-based anomaly detection, reinforcement learning for proactive maintenance scheduling, and natural language processing (NLP) for automated security log analysis. By continuously learning from device interactions and evolving threat patterns, Cognitive Twins predict potential failures and detect security threats before they occur, enabling real-time decision-making and automated responses. Cognitive Twins were evaluated on a large-scale IoT network, consisting of 500 nodes across multiple application domains. The framework achieved a predictive maintenance accuracy of 96.8%, reducing downtime by 35% compared to traditional models. In security applications, Cognitive Twins identified cyber threats with a detection rate of 98.3%, lowering the false positive rate to 1.5%."
10.1016/j.eiar.2023.107332,reinforcement,"Africa is largely confronted with varying issue of socioeconomic and insecurity, which is now increasingly linked with the mounting pressure on the continent's natural capital as glaring in the Sahel and Norther regions. As such, this study further probed the drivers of ecological footprint (EFP) by utilizing panel dataset of 39 African countries over the 1996 to 2018. Considering that several suspected drivers or covariates (which include the economy sectoral aspects, globalization aspects, governance and institutional aspects, energy types, and other socioeconomic aspects) of EFP were considered in the model, the feasibility of multicollinearity and other econometric drawbacks were accounted for by employing a two-step strategy. First, we used the least absolute shrinkage and selection operators (LASSOs) machine learning algorithms to predict the most important drivers of EFP. Second, we employed the Partialing-out LASSO instrumental variable regression (POIVLR) and Bayesian Model Averaging (BMA) techniques to obtain the variables marginal effects. The result found a more parsimonious regularization within the Adaptive LASSO (λ=0.0012), thus selecting 19 regressors out of the 26 covariates. Furthermore, the study found that Adaptive LASSO selection should be employed for inference since it performed better than the rest of the LASSOs and Elasticnet. As for the marginal effect of EFP, the partialing-out LASSO instrumental-variables regression (POIVLR) technique largely established expected impact of the selected covariates on EFP in Africa except for the impact of GDP and its square that shows negative and positive inference respectively. Combining these results and the sensitivity analysis, this study is poised to offer useful policy guide to environmentalist and decision-makers across Africa."
10.1109/ASIANCON62057.2024.10837862,reinforcement,"In the industrial sector, unplanned equipment failures can lead to significant financial losses, safety hazards, and operational inefficiencies. Traditional maintenance strategies, such as reactive maintenance (repair after failure) and preventive maintenance (scheduled maintenance), often prove inadequate in addressing these issues. This not only minimizes downtime but also optimizes maintenance resources and extends the lifespan of equipment. Machine learning models used in Predictive maintenance (PdM) are designed to analyze large volumes of data generated by industrial equipment. Reinforcement learning optimizes maintenance schedules by learning from interactions with the environment, balancing the trade-off between maintenance costs and equipment reliability. Black-box models, such as deep learning, often provide high accuracy but lack transparency. Explainable AI (XAI) techniques are being developed to make these models more interpretable, enabling users to gain insights into the decision-making process and build confidence in the predictions. The deployment of ML models in industrial environments also requires seamless integration with existing systems. This involves addressing issues related to real-time data processing, scalability, and model retraining. Edge computing and cloud-based solutions are being explored to handle large-scale data processing and storage, while online learning techniques allow models to adapt to new data continuously. This paper presents several case studies from industries such as manufacturing, energy, transportation, and healthcare, illustrating the successful application of ML in PdM. In manufacturing, ML models have been used to predict failures in machinery such as turbines, compressors, and conveyor belts, leading to significant reductions in downtime and maintenance costs. The energy sector has employed ML for the maintenance of critical infrastructure, including power grids and wind turbines, enhancing operational efficiency and reliability."
10.1504/IJISE.2008.017555,reinforcement,"Heterarchic manufacturing control system offer a significant potential in terms of capacity, adaptation, self-organisation and real time control for dynamic manufacturing system. In this paper, we present our steps to work out a manufacturing control system where the decisions taken by the system are the result of an agents group work, these agents ensure a continuous improvement of these performance, thanks to the reinforcement learning technique which was introduced to them. This technique of learning makes it possible for the agents to learn the best behaviour in their various roles (answer the requests (risks), self-organisation, plan, etc.) without attenuating the system real time quality. We also introduce a new type of agents called 'observant agent', which has the responsibility to supervise the evolution of the system's total performance. A computer implementation and experimentation of this model are provided in this paper to demonstrate the contribution of our approach. © 2008, Inderscience Publishers."
10.1002/admt.202301286,reinforcement,"Additive manufacturing (AM) is rapidly revolutionizing modern manufacturing with recent progress in advanced printing methods and improved properties of printed materials. However, traditional AM methods are limited by their input-oriented nature, which demands tedious trial-and-error tuning of printing parameters to achieve desired output properties. Here, an output-oriented artificial intelligence-integrated AM (AIAM) method is reported that enables an user to specify desired output properties while the printer autonomously discovers the optimal input printing parameters by integrating hybrid machine learning models and in situ measurements. Based on a predictive mapping between the input printing parameters and the output properties of interests established with <20 experiments designed by active learning, inverse design tasks are performed to intelligently generate the printing parameter settings that lead to desired outcomes using reinforcement learning. This method is demonstrated by autonomous aerosol jet printing (AJP) of conductive polymer films and achieving user-defined electrical resistances with an ultralow error of 3.7%. The AIAM method, with its output-oriented nature, holds the potential to significantly improve the autonomy, predictability, efficiency, and accessibility of the AM processes, which will unlock new possibilities in the autonomous and intelligent printing of a broad range of functional materials and devices."
10.1109/TITS.2022.3183215,reinforcement,"This paper provides a novel intelligent scheduling strategy for a real-world transportation dynamic scheduling case from an engine workshop of general motor company (GMEW), which is a key production line throughout the manufacturing process. In order to reduce the carbon emission in the scheduling process and make up for ignoring the energy consumption of each part in the scheduling when optimizing the carbon emission of the workshop and the factory. This paper first formulates a fuzzy random chance-constrained programming model of inverse scheduling problem (ISP) with energy consumption. A multi-strategy parallel genetic algorithm based on machine learning (RL-MSPGA) is proposed, which uses machine learning to improve the genetic algorithm. First, the parallel idea is developed to accelerate the process of evolution of genetic algorithm, and the initial population is divided into clusters by $k$ -means clustering algorithm. Second, similar individuals are evenly distributed to different sub-populations to ensure the diversity and uniformity of sub-populations. Third, in the process of evolution, the sub-populations communicate with each other, and extend the excellent individuals to replace the poor ones in other populations, so as to improve the overall quality of the population. Fourth, the self-learning of the crossover probability is realized by the self-learning of the self-sensing environment, which makes the crossover probability adapt to the evolutionary process according to experience. Finally, the real instance is used to validate the different algorithms. It can effectively adjust the completion time and the proportion of energy consumption, thus providing the possibility for the production of energy-saving enterprises. This implies that the suggested model is reasonable and the provided algorithm can effectively solve the inverse shop scheduling problem."
